{
	"$schema": "http://json-schema.org/draft-07/schema#",
	"title": "GameConfig",
	"type": "object",
	"additionalProperties": false,
	"required": [
		"gridSize",
		"idleIncome",
		"idleIncomeTimeOut",
		"depositHp",
		"depositIncome",
		"gemPileIncome",
		"coreHp",
		"coreSpawnCooldown",
		"initialBalance",
		"wallHp",
		"wallBuildCost",
		"bombHp",
		"bombCountdown",
		"bombThrowCost",
		"bombReach",
		"bombDamageCore",
		"bombDamageUnit",
		"bombDamageDeposit",
		"worldGenerator",
		"worldGeneratorConfig",
		"units",
		"corePositions"
	],
	"properties": {
		"gridSize": {
			"type": "integer",
			"minimum": 2,
			"maximum": 200
		},
		"seed": {
			"type": "string"
		},
		"idleIncome": {
			"type": "integer",
			"minimum": 0,
			"maximum": 10000000
		},
		"idleIncomeTimeOut": {
			"type": "integer",
			"minimum": 0,
			"maximum": 10000000
		},
		"depositHp": {
			"type": "integer",
			"minimum": 1,
			"maximum": 10000000
		},
		"depositIncome": {
			"type": "integer",
			"minimum": 0,
			"maximum": 10000000
		},
		"gemPileIncome": {
			"type": "integer",
			"minimum": 0,
			"maximum": 10000000
		},
		"coreHp": {
			"type": "integer",
			"minimum": 1,
			"maximum": 10000000
		},
		"coreSpawnCooldown": {
			"type": "integer",
			"minimum": 0,
			"maximum": 10000000
		},
		"initialBalance": {
			"type": "integer",
			"minimum": 0,
			"maximum": 10000000
		},
		"wallHp": {
			"type": "integer",
			"minimum": 0,
			"maximum": 10000000
		},
		"wallBuildCost": {
			"type": "integer",
			"minimum": 0,
			"maximum": 10000000
		},
		"bombHp": {
			"type": "integer",
			"minimum": 0,
			"maximum": 10000000
		},
		"bombCountdown": {
			"type": "integer",
			"minimum": 0,
			"maximum": 10000000
		},
		"bombThrowCost": {
			"type": "integer",
			"minimum": 0,
			"maximum": 10000000
		},
		"bombReach": {
			"type": "integer",
			"minimum": 0,
			"maximum": 10000000
		},
		"bombDamageCore": {
			"type": "integer",
			"minimum": 0,
			"maximum": 10000000
		},
		"bombDamageUnit": {
			"type": "integer",
			"minimum": 0,
			"maximum": 10000000
		},
		"bombDamageDeposit": {
			"type": "integer",
			"minimum": 0,
			"maximum": 10000000
		},
		"worldGenerator": {
			"type": "string",
			"enum": [
				"jigsaw",
				"sparse",
				"hardcoded",
				"empty"
			]
		},
		"worldGeneratorConfig": {
			"type": "object"
		},
		"units": {
			"type": "array",
			"minItems": 1,
			"items": {
				"$ref": "#/$defs/unit"
			}
		},
		"corePositions": {
			"type": "array",
			"minItems": 2,
			"items": {
				"$ref": "#/$defs/position"
			}
		}
	},
	"allOf": [
		{
			"if": {
				"properties": {
					"worldGenerator": {
						"const": "jigsaw"
					}
				},
				"required": [
					"worldGenerator"
				]
			},
			"then": {
				"properties": {
					"worldGeneratorConfig": {
						"$ref": "#/$defs/jigsawCfg"
					}
				}
			}
		},
		{
			"if": {
				"properties": {
					"worldGenerator": {
						"const": "sparse"
					}
				},
				"required": [
					"worldGenerator"
				]
			},
			"then": {
				"properties": {
					"worldGeneratorConfig": {
						"$ref": "#/$defs/sparseCfg"
					}
				}
			}
		},
		{
			"if": {
				"properties": {
					"worldGenerator": {
						"const": "hardcoded"
					}
				},
				"required": [
					"worldGenerator"
				]
			},
			"then": {
				"properties": {
					"worldGeneratorConfig": {
						"$ref": "#/$defs/hardcodedCfg"
					}
				}
			}
		},
		{
			"if": {
				"properties": {
					"worldGenerator": {
						"const": "empty"
					}
				},
				"required": [
					"worldGenerator"
				]
			},
			"then": {
				"properties": {
					"worldGeneratorConfig": {
						"$ref": "#/$defs/emptyCfg"
					}
				}
			}
		}
	],
	"$defs": {
		"position": {
			"type": "object",
			"additionalProperties": false,
			"required": [
				"x",
				"y"
			],
			"properties": {
				"x": {
					"type": "integer",
					"minimum": 0,
					"maximum": 100000
				},
				"y": {
					"type": "integer",
					"minimum": 0,
					"maximum": 100000
				}
			}
		},
		"unit": {
			"type": "object",
			"additionalProperties": false,
			"required": [
				"name",
				"visualizer_asset_path",
				"cost",
				"hp",
				"baseActionCooldown",
				"maxActionCooldown",
				"balancePerCooldownStep",
				"damageCore",
				"damageUnit",
				"damageDeposit",
				"damageWall",
				"damageBomb",
				"buildType"
			],
			"properties": {
				"name": {
					"type": "string",
					"minLength": 1
				},
				"visualizer_asset_path": {
					"type": "string",
					"minLength": 1
				},
				"cost": {
					"type": "integer",
					"minimum": 0
				},
				"hp": {
					"type": "integer",
					"minimum": 0
				},
				"baseActionCooldown": {
					"type": "integer",
					"minimum": 0
				},
				"maxActionCooldown": {
					"type": "integer",
					"minimum": 0
				},
				"balancePerCooldownStep": {
					"type": "integer",
					"minimum": 1
				},
				"damageCore": {
					"type": "integer",
					"minimum": 0
				},
				"damageUnit": {
					"type": "integer",
					"minimum": 0
				},
				"damageDeposit": {
					"type": "integer",
					"minimum": 0
				},
				"damageWall": {
					"type": "integer",
					"minimum": 0
				},
				"damageBomb": {
					"type": "integer",
					"minimum": 0
				},
				"buildType": {
					"type": "string",
					"enum": [
						"none",
						"wall",
						"bomb"
					]
				}
			}
		},
		"jigsawCfg": {
			"type": "object",
			"additionalProperties": false,
			"required": [
				"templatePlaceAttemptCount",
				"additionalWallPlaceAttemptCount",
				"depositCount",
				"gemPileCount",
				"minTemplateSpacing",
				"minCoreDistance",
				"depositAdditionalIncomePerAdjacentWall",
				"depositMultiplierIfFullySurrounded",
				"randomDepositIncomeVariation",
				"randomGemPileIncomeVariation"
			],
			"properties": {
				"templatePlaceAttemptCount": {
					"type": "integer",
					"minimum": 0,
					"maximum": 10000000
				},
				"additionalWallPlaceAttemptCount": {
					"type": "integer",
					"minimum": 0,
					"maximum": 10000000
				},
				"depositCount": {
					"type": "integer",
					"minimum": 0,
					"maximum": 100000
				},
				"gemPileCount": {
					"type": "integer",
					"minimum": 0,
					"maximum": 100000
				},
				"minTemplateSpacing": {
					"type": "integer",
					"minimum": 0,
					"maximum": 1000
				},
				"minCoreDistance": {
					"type": "integer",
					"minimum": 0,
					"maximum": 1000
				},
				"depositAdditionalIncomePerAdjacentWall": {
					"type": "integer",
					"minimum": 0,
					"maximum": 10000000
				},
				"depositMultiplierIfFullySurrounded": {
					"type": "number",
					"minimum": 0,
					"maximum": 1000
				},
				"randomDepositIncomeVariation": {
					"type": "integer",
					"minimum": 0,
					"maximum": 10000000
				},
				"randomGemPileIncomeVariation": {
					"type": "integer",
					"minimum": 0,
					"maximum": 10000000
				}
			}
		},
		"sparseCfg": {
			"type": "object",
			"additionalProperties": false,
			"required": [
				"depositCount",
				"depositBalanceVariation",
				"gemPileCount",
				"gemPileBalanceVariation",
				"wallCount",
				"coreBuffer"
			],
			"properties": {
				"depositCount": {
					"type": "integer",
					"minimum": 0,
					"maximum": 100000
				},
				"depositBalanceVariation": {
					"type": "integer",
					"minimum": 0,
					"maximum": 10000000
				},
				"gemPileCount": {
					"type": "integer",
					"minimum": 0,
					"maximum": 100000
				},
				"gemPileBalanceVariation": {
					"type": "integer",
					"minimum": 0,
					"maximum": 10000000
				},
				"wallCount": {
					"type": "integer",
					"minimum": 0,
					"maximum": 1000000
				},
				"coreBuffer": {
					"type": "integer",
					"minimum": 0,
					"maximum": 1000
				}
			}
		},
		"hardcodedCfg": {
			"type": "object",
			"additionalProperties": false,
			"required": [
				"map"
			],
			"properties": {
				"map": {
					"type": "array",
					"minItems": 1,
					"items": {
						"type": "string",
						"minLength": 1
					}
				}
			}
		},
		"emptyCfg": {
			"type": "object",
			"additionalProperties": false,
			"maxProperties": 0
		}
	}
}